{
  "spec_version": "1.1.0",
  "name": "Vorarlberger Kreuz-Jass",
  "description": "Vorarlberger Variante des Schweizer Jass mit 4 Spielern, einfachem deutschen Blatt (36 Karten), Trumpf-/Gumpf-/Bock-/Geiss-/Slalom-Varianten, Schieben, Weisen, Stöcken und Matsch-Bonus.",
  "sources": [
    "https://jassa.at/regeln/",
    "https://www.mohrenbrauerei.at/biererlebniswelt/community/haeufig-gestellte-fragen-faq/",
    "https://www.jasskarten.at/jassregeln"
  ],
  "deck": {
    "total_cards": 36,
    "suits": [
      {
        "id": 0,
        "name": "EICHEL",
        "german": "Eichel"
      },
      {
        "id": 1,
        "name": "SCHELLE",
        "german": "Schelle"
      },
      {
        "id": 2,
        "name": "HERZ",
        "german": "Herz"
      },
      {
        "id": 3,
        "name": "LAUB",
        "german": "Laub"
      }
    ],
    "ranks": [
      {
        "id": 0,
        "name": "SECHS",
        "german": "Sechs",
        "short": "6"
      },
      {
        "id": 1,
        "name": "SIEBEN",
        "german": "Sieben",
        "short": "7"
      },
      {
        "id": 2,
        "name": "ACHT",
        "german": "Acht",
        "short": "8"
      },
      {
        "id": 3,
        "name": "NEUN",
        "german": "Neun",
        "short": "9"
      },
      {
        "id": 4,
        "name": "ZEHN",
        "german": "Zehn",
        "short": "10"
      },
      {
        "id": 5,
        "name": "UNTER",
        "german": "Unter",
        "short": "U"
      },
      {
        "id": 6,
        "name": "OBER",
        "german": "Ober",
        "short": "O"
      },
      {
        "id": 7,
        "name": "KOENIG",
        "german": "König",
        "short": "K"
      },
      {
        "id": 8,
        "name": "ASS",
        "german": "Ass",
        "short": "A"
      }
    ],
    "card_index_formula": "suit_id * 9 + rank_id",
    "index_range": [
      0,
      35
    ]
  },
  "special_cards": {
    "weli": {
      "suit": "SCHELLE",
      "rank": "SECHS",
      "card_index": 9,
      "role": "trump_announcer_in_round_1",
      "note": "Im laufenden Spiel zählt der Weli wie jede andere 6 (0 Punkte, keine Sonderstärke). Er bestimmt nur, wer in Runde 1 Trumpf ansagt."
    }
  },
  "variants": {
    "trumpf": {
      "id": "trumpf",
      "german": "Trumpf",
      "has_trump_suit": true,
      "trump_suit_options": [
        "EICHEL",
        "SCHELLE",
        "HERZ",
        "LAUB"
      ],
      "card_points": {
        "non_trump": {
          "SECHS": 0,
          "SIEBEN": 0,
          "ACHT": 0,
          "NEUN": 0,
          "ZEHN": 10,
          "UNTER": 2,
          "OBER": 3,
          "KOENIG": 4,
          "ASS": 11
        },
        "trump": {
          "SECHS": 0,
          "SIEBEN": 0,
          "ACHT": 0,
          "NEUN": 14,
          "ZEHN": 10,
          "UNTER": 20,
          "OBER": 3,
          "KOENIG": 4,
          "ASS": 11
        }
      },
      "rank_order_desc": {
        "non_trump": [
          "ASS",
          "KOENIG",
          "OBER",
          "UNTER",
          "ZEHN",
          "NEUN",
          "ACHT",
          "SIEBEN",
          "SECHS"
        ],
        "trump": [
          "UNTER",
          "NEUN",
          "ASS",
          "KOENIG",
          "OBER",
          "ZEHN",
          "ACHT",
          "SIEBEN",
          "SECHS"
        ]
      },
      "rules": {
        "follow_lead_suit_if_possible": true,
        "buur_exception": {
          "active": true,
          "description": "Trumpf-Unter (Buur) darf immer gespielt werden, auch wenn der Spieler die Lead-Farbe bedienen könnte. Bei Trumpf-Lead darf der Buur als einziger Trumpf zurückgehalten werden."
        },
        "no_undertrumping": {
          "active": true,
          "description": "Liegt schon ein Trumpf im Stich, darf nur höher getrumpft werden; Untertrumpfen ist nur erlaubt, wenn keine andere Karte spielbar ist."
        },
        "stichzwang": {
          "active": false,
          "description": "Wer die Lead-Farbe nicht bedienen kann, darf frei abwerfen — es besteht keine Pflicht zu trumpfen."
        }
      },
      "stoecke": {
        "active": true,
        "cards": [
          "trump_OBER",
          "trump_KOENIG"
        ],
        "points": 20,
        "announce_timing": "after_second_stock_card_played",
        "competes_with_other_weisen": false
      }
    },
    "gumpf": {
      "id": "gumpf",
      "german": "Gumpf",
      "has_trump_suit": true,
      "trump_suit_options": [
        "EICHEL",
        "SCHELLE",
        "HERZ",
        "LAUB"
      ],
      "card_points": {
        "non_trump": {
          "SECHS": 0,
          "SIEBEN": 0,
          "ACHT": 0,
          "NEUN": 0,
          "ZEHN": 10,
          "UNTER": 2,
          "OBER": 3,
          "KOENIG": 4,
          "ASS": 11
        },
        "trump": {
          "SECHS": 0,
          "SIEBEN": 0,
          "ACHT": 0,
          "NEUN": 14,
          "ZEHN": 10,
          "UNTER": 20,
          "OBER": 3,
          "KOENIG": 4,
          "ASS": 11
        }
      },
      "rank_order_desc": {
        "non_trump": [
          "SECHS",
          "SIEBEN",
          "ACHT",
          "NEUN",
          "ZEHN",
          "UNTER",
          "OBER",
          "KOENIG",
          "ASS"
        ],
        "trump": [
          "UNTER",
          "NEUN",
          "ASS",
          "KOENIG",
          "OBER",
          "ZEHN",
          "ACHT",
          "SIEBEN",
          "SECHS"
        ]
      },
      "rules": {
        "follow_lead_suit_if_possible": true,
        "buur_exception": {
          "active": true,
          "description": "Trumpf-Unter (Buur) darf auch im Gumpf jederzeit gespielt werden — die Trumpf-Farbe verhält sich genauso wie bei der normalen Trumpf-Variante."
        },
        "no_undertrumping": {
          "active": true,
          "description": "In der Trumpf-Farbe gilt im Gumpf das gleiche Untertrumpf-Verbot wie in der normalen Trumpf-Variante."
        },
        "stichzwang": {
          "active": false,
          "description": "Wer die Lead-Farbe nicht bedienen kann, darf frei abwerfen — es besteht keine Pflicht zu trumpfen."
        },
        "note": "Gumpf = 'Geiss + Trumpf': In der Trumpf-Farbe gelten Trumpf-Werte (Buur=20, Nell=14) und Trumpf-Reihenfolge. In allen anderen Farben ist die Stärke invertiert: die 6 in der Lead-Farbe sticht alles Nicht-Trumpf. Wertpunkte in Nicht-Trumpf bleiben wie bei der Trumpf-Variante (8er=0, kein Geiss-8er-Bonus)."
      },
      "stoecke": {
        "active": true,
        "cards": [
          "trump_OBER",
          "trump_KOENIG"
        ],
        "points": 20,
        "announce_timing": "after_second_stock_card_played",
        "competes_with_other_weisen": false
      }
    },
    "oben": {
      "id": "oben",
      "german": "Bock (oben)",
      "has_trump_suit": false,
      "card_points": {
        "SECHS": 0,
        "SIEBEN": 0,
        "ACHT": 8,
        "NEUN": 0,
        "ZEHN": 10,
        "UNTER": 2,
        "OBER": 3,
        "KOENIG": 4,
        "ASS": 11
      },
      "rank_order_desc": {
        "lead_suit": [
          "ASS",
          "KOENIG",
          "OBER",
          "UNTER",
          "ZEHN",
          "NEUN",
          "ACHT",
          "SIEBEN",
          "SECHS"
        ]
      },
      "rules": {
        "follow_lead_suit_if_possible": true,
        "buur_exception": {
          "active": false
        },
        "no_undertrumping": {
          "active": false
        },
        "stichzwang": {
          "active": false
        },
        "note": "Nur Lead-Farbe sticht — Karten anderer Farben können nie gewinnen."
      },
      "stoecke": {
        "active": false
      }
    },
    "unten": {
      "id": "unten",
      "german": "Geiss (unten)",
      "has_trump_suit": false,
      "card_points": {
        "SECHS": 0,
        "SIEBEN": 0,
        "ACHT": 8,
        "NEUN": 0,
        "ZEHN": 10,
        "UNTER": 2,
        "OBER": 3,
        "KOENIG": 4,
        "ASS": 11
      },
      "rank_order_desc": {
        "lead_suit": [
          "SECHS",
          "SIEBEN",
          "ACHT",
          "NEUN",
          "ZEHN",
          "UNTER",
          "OBER",
          "KOENIG",
          "ASS"
        ]
      },
      "rules": {
        "follow_lead_suit_if_possible": true,
        "buur_exception": {
          "active": false
        },
        "no_undertrumping": {
          "active": false
        },
        "stichzwang": {
          "active": false
        },
        "note": "Umgekehrte Reihenfolge: die 6 sticht alles in der Lead-Farbe. Karten anderer Farben können nie gewinnen."
      },
      "stoecke": {
        "active": false
      }
    },
    "slalom": {
      "id": "slalom",
      "german": "Slalom",
      "alternating_modes": [
        "oben",
        "unten"
      ],
      "starter_chooses_first_mode": true,
      "card_points_inherit_from": [
        "oben",
        "unten"
      ],
      "rules": {
        "mode_switches_per_trick": true,
        "description": "Der Ansager wählt, ob mit Bock (oben) oder Geiss (unten) begonnen wird; der Modus wechselt dann nach jedem Stich."
      },
      "stoecke": {
        "active": false
      }
    }
  },
  "scoring": {
    "card_points_per_round": 152,
    "last_trick_bonus": 5,
    "total_points_per_round": 157,
    "match_bonus": 100,
    "match_definition": "Ein Team gewinnt alle 9 Stiche einer Runde.",
    "team_scoring_convention": "Üblicherweise zählt nur das Team mit weniger Stichen seine Punkte; das andere Team bekommt (TOTAL_POINTS_PER_ROUND − x). Beide Werte müssen sich zu 157 (bzw. 257 bei Matsch) summieren — wichtige Konsistenzprüfung in jeder Engine-Implementierung."
  },
  "weise": {
    "sequences": {
      "3_blatt": 20,
      "4_blatt": 50,
      "5_blatt": 100,
      "6_blatt": 120,
      "7_blatt": 140,
      "8_blatt": 160,
      "9_blatt": 180
    },
    "four_of_kind": {
      "UNTER": 200,
      "NEUN": 150,